App_Category,App_Type,Score,Review_Date,Review_Content,Thumbs_Up
Digital Fintech A,Digital Fintech,1,2026-06-11 15:33:26,"Very disappointing experience. I created a PayPal account with my real details, linked my bank account, and hadn't even made a single transaction. Within days, my account was permanently deactivated for ""unusual activity"" without any clear explanation. Customer support provided no meaningful details or resolution path. Legitimate users deserve transparency and a chance to verify their identity before facing permanent account restrictions.",2
Digital Fintech A,Digital Fintech,5,2026-06-11 15:13:27,"PayPal is one of the most reliable and secure online payment platforms I have used. Sending and receiving money is simple, transactions are fast, and the interface is easy to understand. I appreciate the extra security features and the ability to make payments to people and businesses worldwide. Overall, PayPal provides a convenient and trustworthy experience, and I highly recommend it.",0
Digital Fintech A,Digital Fintech,5,2026-06-11 15:09:09,Easy and quick to send money and pay for goods. Love the fact I can send money to people in different currency easily.,1
Digital Fintech A,Digital Fintech,5,2026-06-11 15:01:32,love using paypal for my business transaction.,0
Digital Fintech A,Digital Fintech,1,2026-06-11 14:55:15,Not a fan of how they do things. I hoped to use it as a means to pay people and transfer money between accounts but they try to hard to do things they think I want and don't with no way to turn off the features I don't like. They have potential to make the app great but dont care enough to do just that. I closed my account and plan to permenantly not use the them due to my dislike of the way they went about doing things and how they would transfer or move money without my consent.,1
Digital Fintech A,Digital Fintech,2,2026-06-11 14:50:51,"Very buggy. Very little customer support. No ability to request refunds, yet they still have the ability to make purchases for you using your money. Backwards thinking. If you can't process my refund, you do NOT get to handle my money.",2
Digital Fintech A,Digital Fintech,5,2026-06-11 14:48:19,"works great, safe, reliable",0
Digital Fintech A,Digital Fintech,4,2026-06-11 14:39:59,"Used to be a 5 star app, but I feel like they've gotten greedy with the fees over recent years compared to similar apps.",0
Digital Fintech A,Digital Fintech,1,2026-06-11 14:25:35,The customer service is awful I was at work my account got hacked They got into my email sent themselves a code and got in my account They sent me money I didn't say yes to they took over my account and said yes on their own so it looked like I knew them and then they made a pay request went back into their own paypal and robbed me I called paypal and I told them I didn't know who this was they made me feel like they were on my side they took their side and closed my account,0
Digital Fintech A,Digital Fintech,5,2026-06-11 14:14:39,it's a good thing,0
Digital Fintech A,Digital Fintech,5,2026-06-11 13:17:46,great,0
Digital Fintech B,Digital Fintech,5,2026-06-20 15:00:55,This has been a positive exsperience for me. Iv used cash app for a couple of years now never had any negative instances.. actually it is a simple to use platform im not real good with computers or use of anything tecnical. this app made banking moving sending recieving money childs play . I highly recommend cash app to any one who wants to take the easy way out when it comes to personal or busyness level banking. Kenneth Schwan Founder of ( Homeless awareness Bringing back Humanity) campaign..,0
Digital Fintech B,Digital Fintech,5,2026-06-20 14:54:49,Look it's me brenda gata Lopez and wanted to tell you folks your doing a GRATE JOB ON YOUR END ...KEEP IT UP ....GATA LOPEZ,0
Digital Fintech B,Digital Fintech,5,2026-06-20 14:41:11,Convenient. Simple. Haven't experienced any issues.,0
Digital Fintech B,Digital Fintech,5,2026-06-20 14:04:02,This App is great and so many features to use and invest money.,0
Digital Fintech B,Digital Fintech,5,2026-06-20 13:40:11,cash app is the way togo,0
Digital Fintech B,Digital Fintech,5,2026-06-20 13:31:52,noice,0
Digital Fintech B,Digital Fintech,5,2026-06-20 12:58:12,simply the Best hands down,0
Digital Fintech B,Digital Fintech,5,2026-06-20 12:20:36,I love the app great app easy to work,0
Digital Fintech B,Digital Fintech,5,2026-06-20 12:13:51,varry Good 😊💯 the Best,0
Digital Fintech B,Digital Fintech,5,2026-06-20 12:00:09,"Tuff, I get ez money",0
Digital Fintech B,Digital Fintech,5,2026-06-20 10:48:17,excelente asta a horita para mi lo mejor.,0
Digital Fintech B,Digital Fintech,1,2026-06-20 10:28:06,killed my account for no reason,0
Digital Fintech B,Digital Fintech,5,2026-06-20 09:34:43,Great!!,0
Digital Fintech B,Digital Fintech,4,2026-06-20 09:16:14,"I'm just ordering my card, so I'm not sure how this will work ? ???",0
Digital Fintech B,Digital Fintech,2,2026-06-20 09:15:23,"Honestly a good app for money transfer and not an issue to do with that. This app has such a brain dead face and ID scanning feature it's not even funny. I had done it a while back, but the app asked for it again. I decided to do it and when I failed it deleted my ENTIRE account. Thankfully I didn't lose money, but the fact I could have is beyond messed up. No idea what they are using for it, and now I have to wait up to 10 business days... this has got to stop at some point.",0
Digital Fintech B,Digital Fintech,4,2026-06-20 08:47:55,good 👍,0
Digital Fintech B,Digital Fintech,5,2026-06-20 08:37:44,I need a new cash app card,0
Digital Fintech B,Digital Fintech,5,2026-06-20 08:26:31,it's really easy way of earning cash,0
Digital Fintech B,Digital Fintech,5,2026-06-20 07:53:12,Five-star,0
Digital Fintech B,Digital Fintech,1,2026-06-20 07:49:21,won't work on my phone,0
Digital Fintech B,Digital Fintech,5,2026-06-20 07:27:15,Great 👍,0
Digital Fintech B,Digital Fintech,5,2026-06-20 06:55:50,great something I could use,0
Digital Fintech B,Digital Fintech,5,2026-06-20 06:53:24,I love giving money away this easy 😌,0
Digital Fintech B,Digital Fintech,5,2026-06-20 06:51:29,🙏,0
Digital Fintech B,Digital Fintech,3,2026-06-20 06:50:43,it's a good app to use to pay for stuff it's just the ai support isn't the best.,0
Digital Fintech B,Digital Fintech,5,2026-06-20 06:50:19,great oh my gosh this app is 🤑🤗,0
Digital Fintech B,Digital Fintech,5,2026-06-20 06:27:43,THIS IS ONE IF THE BEST APPS. YOU CAN USE . TRY IT 😄 YOU MY LOLE ITE,1
Digital Fintech B,Digital Fintech,4,2026-06-20 06:09:03,I think cash app should go back 2 where as you can borrow money,0
Digital Fintech B,Digital Fintech,5,2026-06-20 05:57:04,convenients of this card has been helpful.,0
Digital Fintech B,Digital Fintech,5,2026-06-20 05:15:28,it's great for young people like me it teaches us how to use money and gives card to keep up with it this is good for young teens especially when the get a card,0
Digital Fintech B,Digital Fintech,5,2026-06-20 05:14:45,"Need help with money sometimes, this will help you out.",0
Digital Fintech B,Digital Fintech,5,2026-06-20 05:08:30,So easy to send and receive money 💰,0
Digital Fintech B,Digital Fintech,5,2026-06-20 05:05:47,outstanding app lets me transfer money quickly services rendered.,0
Digital Fintech B,Digital Fintech,5,2026-06-20 05:00:02,It's a very unique app. There's a lot they offer with simplicity. I'm impressed..,0
Digital Fintech B,Digital Fintech,1,2026-06-20 04:58:43,did not want to give me an account so I don't like them,0
Digital Fintech B,Digital Fintech,5,2026-06-20 04:55:01,easy to use and access or send funds.,0
Digital Fintech B,Digital Fintech,5,2026-06-20 04:54:48,ease,0
Digital Fintech B,Digital Fintech,5,2026-06-20 04:47:31,very good I like it. Works good easy very good support group.,0
Digital Fintech B,Digital Fintech,5,2026-06-20 04:31:03,💯,0
Digital Fintech B,Digital Fintech,5,2026-06-20 04:29:13,good,0
Digital Fintech B,Digital Fintech,4,2026-06-20 04:26:20,nice,0
Digital Fintech B,Digital Fintech,5,2026-06-20 04:25:41,"Amazing, just love. ❤️",0
Digital Fintech B,Digital Fintech,1,2026-06-20 04:24:02,"you guys keep updating and causing more issues i cant even unlock my card because the unlock slide button isnt there its just a little lock and it won't open whether I hit it once, hold it, or slide it.",0
Digital Fintech B,Digital Fintech,1,2026-06-20 04:20:25,I got to successfully add account with email and phone. I log in it's says successfully and when I hit continue it says it can't verify my account. got nowhere with customer support. they said I have to log into the app to delete the account. and I kept telling them how can I delete it from the app if I can't get logged in. worst app I ever had to deal with,0
Digital Fintech B,Digital Fintech,5,2026-06-20 04:16:44,great,0
Digital Fintech B,Digital Fintech,5,2026-06-20 04:16:35,easy and convenient banking app,0
Digital Fintech B,Digital Fintech,5,2026-06-20 04:15:01,Cash App is one of my favorite banking apps for sure.,0
Digital Fintech B,Digital Fintech,4,2026-06-20 04:05:41,some stuff is there at times and other times not like trading selling stocks,0
Digital Fintech B,Digital Fintech,5,2026-06-20 04:00:14,Cash app is like Frosted Flakes.... There Grrrrreat!,0
Digital Fintech B,Digital Fintech,5,2026-06-20 03:56:40,I haven't used Cash App before but I thin̈ķ I will like it. I'm going to try it.,0
Digital Fintech B,Digital Fintech,5,2026-06-20 03:52:03,very good app.,0
Digital Fintech B,Digital Fintech,5,2026-06-20 03:40:02,nice and smooth banking,0
Digital Fintech B,Digital Fintech,5,2026-06-20 03:24:42,great good ever lasting,0
Digital Fintech B,Digital Fintech,5,2026-06-20 03:24:20,most awesomest card ever 🥰🥰,0
Digital Fintech B,Digital Fintech,5,2026-06-20 03:16:24,Easy to set up and easy to use.,0
Digital Fintech B,Digital Fintech,5,2026-06-20 03:06:48,excellent,0
Digital Fintech B,Digital Fintech,1,2026-06-20 03:06:46,I have been trying to find out what happened to the money I have been getting on my account Iam been interrupted and asked the same question over and over I gave them the date time also my email address cashtag they keep saying it is not working I had to ask to speak to a supervisor I was asked to give them my information about what I wanted to talk about I never got a supervisor one of the rep. actually was talking to me I would like to know if anyone else has a ideal who to contact because ?,0
Digital Fintech B,Digital Fintech,5,2026-06-20 03:05:37,I've had cash app for going on 10yrs and I love it!!!!!,0
Digital Fintech B,Digital Fintech,5,2026-06-20 03:03:03,thank,0
Digital Fintech B,Digital Fintech,5,2026-06-20 02:23:35,love it,0
Digital Fintech B,Digital Fintech,5,2026-06-20 02:05:04,absolutely love cash app it's a must have,0
Digital Fintech B,Digital Fintech,5,2026-06-20 01:55:09,"I don't know y people talk bad about cash app. personally this is 1 of my best experiences with any sort of Bank. not only do I not deal with any of the usual Bank BS, like absolutely none whatsoever. cash app is the only bank that has ever offered me loan, they started me off at $50 when they saw I was capable of paying that back they up'd me up to 100, 150 and so on. you have to pay the loan back in 30 days and I think 500 is the limit, I think with afterpay it's $1000 now. best bank ever",0
Digital Fintech B,Digital Fintech,3,2026-06-20 01:50:44,"The app works fine. The rest of the company, not so much...",0
Digital Fintech B,Digital Fintech,1,2026-06-20 01:40:25,"wish I could put a negative star. got denied, and now they stole my money that I or my boyfriend can't get back.",0
Digital Fintech B,Digital Fintech,5,2026-06-20 01:25:10,Greate! I love it,0
Digital Fintech B,Digital Fintech,1,2026-06-20 01:20:15,"generally worked ok, took a while to get my back account synced with my cash app but eventually the app kept opening by itself and I had force stopped it like 3 times before just deleting it.",0
Digital Fintech B,Digital Fintech,1,2026-06-20 01:00:05,Trash,0
Digital Fintech B,Digital Fintech,5,2026-06-20 00:53:19,Why did it take so long for someone to make it this simple?,0
Digital Fintech B,Digital Fintech,5,2026-06-20 00:40:58,great way to save,0
Digital Fintech B,Digital Fintech,5,2026-06-20 00:34:26,it is cool and I love the card designs but I wish they had wwe designs besides that i really love this app 5 stars,0
Digital Fintech B,Digital Fintech,1,2026-06-20 00:27:55,"I loathe the fact that if you cancel an order through a delivery app....they hold your money for 10 days!!! It isn't a refund, it's a canceled order...they need to change that!",0
Digital Fintech B,Digital Fintech,5,2026-06-20 00:27:26,Great to have when needed,0
Digital Fintech B,Digital Fintech,5,2026-06-20 00:27:04,great app. you can do so much,0
Digital Fintech B,Digital Fintech,1,2026-06-20 00:22:36,"cashapp offers borrow, a loan service, they say if you can't make the payment, they will charge you interest, instead they will take money themselves from your bank card and pay themselves, even if it over draws your bank card. then their customer service members will be snotty and holier than thou about it when you ask them why they used your bank card. fk cashapp. kings of predatory loans. I'm no longer a customer",0
Digital Fintech B,Digital Fintech,5,2026-06-20 00:12:22,I love it,0
Digital Fintech B,Digital Fintech,1,2026-06-19 23:59:10,someone somehow got my cash app card information and keeps trying to make a $29.99 purchase from select basics and even though I BLOCKED THE STORE they are still allowed to attempt to make purchases and would've succeeded one night if I had enough on my card. luckily I didn't but I have to lock my card immediately after making purchases just so that won't happen. it's absolutely ridiculous and there's no way to report it unless the transaction actually comes through so I would lose $,0
Digital Fintech B,Digital Fintech,5,2026-06-19 23:42:33,thank you very much so,0
Digital Fintech B,Digital Fintech,4,2026-06-19 23:41:18,play the best in the world some things can be a little better like crashing but they'll never get under four stars you may cuz they are that good www but they always try to do the best they could and it was always what we need it one of the best in the world,0
Digital Fintech B,Digital Fintech,5,2026-06-19 23:29:10,always great,0
Digital Fintech B,Digital Fintech,4,2026-06-19 23:21:44,I haven't been able to set a pin on my account! I can't do anything with this account I can't put money on it or use it i don't understand what's going on with thos card it's really frusterating...please help me fix this card,0
Digital Fintech B,Digital Fintech,5,2026-06-19 23:00:51,Easiest to send cash,0
Digital Fintech B,Digital Fintech,4,2026-06-19 22:58:04,Easy to do,0
Digital Fintech B,Digital Fintech,5,2026-06-19 22:57:41,great app,0
Digital Fintech B,Digital Fintech,2,2026-06-19 22:46:17,"""Offers"" need work and they keep trying to sell you new cards. Offers will only select the lowest value coupon to apply. Example, if you have two grocery coupons, 3% and 10%, you must remove all other offers from your card for the 10% to be applied. The system will select the lowest value first and you can't change it. I called and checked. Now you wasted your monthly grocery trip, your ten percent coupon will expire and you're out ten bucks you could have saved. Bastards. Not happy. 🤬",0
Digital Fintech B,Digital Fintech,5,2026-06-19 22:42:49,it's okay,0
Digital Fintech B,Digital Fintech,3,2026-06-19 22:40:10,something went wrong....why?,0
Digital Fintech B,Digital Fintech,4,2026-06-19 22:31:33,ok,0
Digital Fintech B,Digital Fintech,5,2026-06-19 22:27:34,I like it they good job,0
Digital Fintech B,Digital Fintech,1,2026-06-19 22:26:38,its sucks,0
Digital Fintech B,Digital Fintech,5,2026-06-19 22:08:31,Great,0
Digital Fintech B,Digital Fintech,5,2026-06-19 22:08:29,ok app,0
Digital Fintech B,Digital Fintech,5,2026-06-19 21:54:31,conviant oh,0
Digital Fintech B,Digital Fintech,5,2026-06-19 21:49:57,pretty good works great and I use it for doing lawn care all the time,0
Digital Fintech B,Digital Fintech,5,2026-06-19 21:22:34,I love it ty cash app,0
Digital Fintech B,Digital Fintech,1,2026-06-19 21:18:55,doesnt accept my discover debit card,0
Digital Fintech B,Digital Fintech,5,2026-06-19 21:03:05,"I haven't used it lots yet, but so far I love it!",0
Digital Fintech B,Digital Fintech,1,2026-06-19 20:58:50,"I use to love cash app bit I wouldn't install it now. they will closed down your account with no explanation of why, and when you call no one knows anything. when you only use it at convenience stores and Amazon.",0
Digital Fintech B,Digital Fintech,1,2026-06-19 20:57:41,since they hold your refund in pending for too long and point the finger back at the bank that released the refund I have to give this review. will be closing this account soon. Make sure you are making the right purchase because they will hold your money in pending for as long as they like. Stone Age problems. This issue has become so devastating that I am cancelling this account as soon as my refund finally is given to me from the pending section it's been sitting in for days.,2
Digital Fintech B,Digital Fintech,1,2026-06-19 20:56:38,"The customer service is horrendous, they barely speak English its cheap service and they just rattle on. they never tell you what part of the so-called terms you didn't follow and they can't seem to understand basic concepts. I'll be happy to delete cashapp until they bring back American customer service that actually does something for their customers. at this point it's basically trash app.",0
Digital Fintech B,Digital Fintech,5,2026-06-19 20:32:47,An app u can trust!,0
Digital Fintech B,Digital Fintech,1,2026-06-19 20:24:31,Easy to load and very good applications.,0
Digital Fintech B,Digital Fintech,5,2026-06-19 20:18:10,beyond awsome,0
Digital Fintech B,Digital Fintech,2,2026-06-19 20:00:43,I have had to file two disputes now and my phone has been turned off twice now as a result and probably will again in 30 days. cash app is requiring me to keep an Internet connection for this dispute to happen and my balance is only $1.55. I don't think I will be able to keep my connection past 30 days as I do not have enough to buy more phone minutes until the dispute is settled.,0
Digital Fintech B,Digital Fintech,5,2026-06-19 19:54:10,tuff,0
Digital Fintech B,Digital Fintech,5,2026-06-19 19:51:02,cash appt is an awesome appt they take real good care of their customers and any issues that you have or encounter they quickly resolve it,0
Digital Fintech B,Digital Fintech,5,2026-06-19 19:50:33,I love this app I've never had any money taking off my card unless I have unlocked it and I really like being able to lock it back when I'm done this is such a convenient app. I'd recommended anyone,0
Digital Fintech B,Digital Fintech,5,2026-06-19 19:17:40,it works,0
Digital Fintech B,Digital Fintech,4,2026-06-19 19:04:56,great app I enjoy every moment with it so helpful,0
Digital Fintech B,Digital Fintech,5,2026-06-19 18:55:42,Cash App allows me to pay someone and accept payments from others for my food deliveries! The App is easy to understand and use.,0
Digital Fintech B,Digital Fintech,5,2026-06-19 18:50:54,great app! Id definitely recommend,0
Digital Fintech B,Digital Fintech,2,2026-06-19 18:39:53,"my other account got hacked, had my money stolen",0
Digital Fintech B,Digital Fintech,5,2026-06-19 18:31:37,thank you 🙏,0
Digital Fintech B,Digital Fintech,4,2026-06-19 18:25:56,"If you're not too careful and don't learn about this. On other social media, then you will get so scammed on his app. Do not put all of your money on this app. But that's not the app's fault kind of it's very good, though, definitely a good recommendation for sending quick money to people or receiving it. They do got good benefits. If you look at them see what's right for you 4 stars?",0
Digital Fintech B,Digital Fintech,3,2026-06-19 17:47:41,Can't delete people you previously paid.,0
Digital Fintech B,Digital Fintech,5,2026-06-19 17:45:35,muy Buena application como ase fslta,0
Digital Fintech B,Digital Fintech,5,2026-06-19 17:26:33,very good and helpfull,0
Digital Fintech B,Digital Fintech,3,2026-06-19 17:25:40,they will not let me,0
Digital Fintech B,Digital Fintech,5,2026-06-19 17:03:41,Such a convenient and easy to use app.,0
Digital Fintech B,Digital Fintech,2,2026-06-19 16:57:36,The app suggests to be updated. I updated it more than 5 times. I finally uninstall it several times and re install it but it keeps suggesting to be updated. I couldn't finish the transaction.,0
Digital Fintech B,Digital Fintech,5,2026-06-19 16:40:32,cash app is awesome and instant.,0
Digital Fintech B,Digital Fintech,5,2026-06-19 16:34:58,how to order my card,0
Digital Fintech B,Digital Fintech,2,2026-06-19 16:33:23,"I got this app for accepting payments for a shuttle service for US military soldiers. Your service is not acceptable for receiving payments. The soldiers would send me a payment of $3.00. Your service cut all payment activity with NO NOTICE. and you marked the payment as ""payment failed"". you did this to me in the middle of the day on a busy afternoon with no explanation on 3 separate occasions. I called repeatedly about this issue for an explanation and none was given",0
Digital Fintech B,Digital Fintech,4,2026-06-19 16:31:03,best option,0
Digital Fintech B,Digital Fintech,5,2026-06-19 16:21:30,my money back pls,0
Digital Fintech B,Digital Fintech,5,2026-06-19 15:48:36,very good,0
Digital Fintech B,Digital Fintech,4,2026-06-19 15:34:24,you can't get your money back if you send it to the wrong person.,0
Digital Fintech B,Digital Fintech,3,2026-06-19 15:23:55,it's ok when you don't have a bank account and need one fast,0
Digital Fintech B,Digital Fintech,4,2026-06-19 15:15:09,I Love Cashapp,0
Digital Fintech B,Digital Fintech,5,2026-06-19 14:58:42,very easy great work,0
Digital Fintech B,Digital Fintech,5,2026-06-19 14:23:31,"Great way to protect the amount you spend when limit control balance, I use it when my child goes on school activities.",0
Digital Fintech B,Digital Fintech,5,2026-06-19 13:54:45,it works i love sharing money with my friends and family love it,0
Digital Fintech B,Digital Fintech,4,2026-06-19 13:52:03,Cash app works and tryna get my new house plus the store and tryna borrow off cash app it's not available nowhere on the app at this point today cash app make it available for somebody to borrow please.,1
Digital Fintech B,Digital Fintech,1,2026-06-19 13:41:19,very bad,0
Digital Fintech B,Digital Fintech,1,2026-06-19 13:39:55,awful,0
Digital Fintech B,Digital Fintech,5,2026-06-19 13:13:43,Easy,0
Digital Fintech B,Digital Fintech,5,2026-06-19 12:53:51,easy to lock card and they protect your account from fraud charges,0
Digital Fintech B,Digital Fintech,5,2026-06-19 11:56:14,good,0
Digital Fintech B,Digital Fintech,1,2026-06-19 11:33:11,"Easily hackable, hi-jackable, traceable and held up in court of law.",0
Digital Fintech B,Digital Fintech,5,2026-06-19 11:13:48,THANK YOU.,0
Digital Fintech B,Digital Fintech,1,2026-06-19 10:48:10,this company needs to be closed down how do you sent someone money and then be in violation of the terms and conditions,0
Digital Fintech B,Digital Fintech,1,2026-06-19 10:47:45,some stole $40.00 & customer service ran game then when I called back they closed.,0
Digital Fintech B,Digital Fintech,1,2026-06-19 10:29:35,cash app reset my acout that had $50.87 on I'll was trying to sign in and lost everything I got in closed the app it signed me I sign back in and my account isn't connected to my cash app account before it made me make a new cash app tag I do it and I lost all my money on it now all I have is the last $10 I'm my wallet for food this week,0
Digital Fintech B,Digital Fintech,5,2026-06-19 10:19:41,love cash app,0
Digital Fintech B,Digital Fintech,5,2026-06-19 08:41:16,great app,0
Digital Fintech B,Digital Fintech,5,2026-06-19 08:17:25,Great,0
Digital Fintech B,Digital Fintech,5,2026-06-19 08:05:29,quick and easy to get it all set up and ready to go right away. I recommend it to anyone that spends a lot of money online.,0
Digital Fintech B,Digital Fintech,5,2026-06-19 07:47:46,Excellent On top of there game,0
Digital Fintech B,Digital Fintech,5,2026-06-19 07:45:21,"Convenient, free and instantaneous.",0
Digital Fintech B,Digital Fintech,4,2026-06-19 06:58:35,easy to understand,0
Digital Fintech B,Digital Fintech,5,2026-06-19 06:52:18,epic,0
Digital Fintech B,Digital Fintech,1,2026-06-19 06:45:20,"unlocked card before i left used card says: ""expired"" called cash app telling you amount not this time, called it sends texts🤥 it did not i know they can block card says doesn't exist then put it back nov 2025 they did aug $22 still missing nothing on website but its on the app 👆🏾 in business?🫵🏾go to website everyone says then block you. im not having issue with the card 🫵🏾you ppl BLOCKED THEM TO STEAL. $22 missing still. block block block all they do🤫 app? useless 👈🏾they control it",4
Digital Fintech B,Digital Fintech,1,2026-06-19 06:23:47,it was great ez to use until you start noticing money missing......,1
Digital Fintech B,Digital Fintech,5,2026-06-19 06:19:28,Woohoo,0
Digital Fintech B,Digital Fintech,5,2026-06-19 06:16:14,love this app couldnt.live without it,0
Digital Fintech B,Digital Fintech,1,2026-06-19 05:55:07,I wanna talk to corporate about my account,0
Digital Fintech B,Digital Fintech,5,2026-06-19 05:49:02,I have had an excellent experience with cashapp,0
Digital Fintech B,Digital Fintech,5,2026-06-19 05:48:26,like cash app,0
