App_Category,App_Type,Score,Review_Date,Review_Content,Thumbs_Up
Digital Fintech A,Digital Fintech,1,2026-06-20 11:39:03,too much fee charges,0
Digital Fintech A,Digital Fintech,1,2026-06-20 11:17:51,If I can rate this a negative star. all my transaction is legal then suddenly they hold my funds for 180 days and permanently block my account even I send proofs all they need to my transaction it's worst don't use this app!!!,0
Digital Fintech A,Digital Fintech,5,2026-06-20 11:00:42,Very Great full to PayPal.,0
Digital Fintech A,Digital Fintech,5,2026-06-20 10:32:50,Everything is easy to understand and function.,0
Digital Fintech A,Digital Fintech,5,2026-06-20 09:13:44,awesome pay app appreciate everything great job,0
Digital Fintech A,Digital Fintech,1,2026-06-20 09:00:33,waste of my time worthless,0
Digital Fintech A,Digital Fintech,1,2026-06-20 08:57:43,I am so mad i need to rest my password because my old account is old so I give it the code from my email and then it still want me to do more?? what the phone numbers old so I can use the text me so I go to help and press chat and I need to be logged in to talk with someone THE PROBLEM IS I CANT LOGIN IN over all this is a very stressful experience now I will have to wait till tomorrow to call and try to get this fixed over all So far me coming back to this app has stressed me out.,0
Digital Fintech A,Digital Fintech,5,2026-06-20 08:23:08,Love,0
Digital Fintech A,Digital Fintech,5,2026-06-20 08:20:43,good apps for money,0
Digital Fintech A,Digital Fintech,5,2026-06-20 08:20:05,paypal is secure and convenient way to send and receive money online with fast transactions and wide acceptance worldwide,0
Digital Fintech A,Digital Fintech,5,2026-06-20 08:17:40,I choose PayPal over the others. I've had for over 10 years and have had no problems. 👍,0
Digital Fintech A,Digital Fintech,5,2026-06-20 08:17:39,Great 👍,0
Digital Fintech A,Digital Fintech,5,2026-06-20 07:58:38,quick and easy to use for payment all across the country,0
Digital Fintech A,Digital Fintech,5,2026-06-20 07:48:25,"I use PayPal for almost all.of my online purchases. it's safe, easy, convenient and hassle-free.",0
Digital Fintech A,Digital Fintech,5,2026-06-20 07:22:23,this app is amazingly helpful stress free cute notes and images to send family an friends when sending $ ⭐⭐⭐⭐⭐,0
Digital Fintech A,Digital Fintech,1,2026-06-20 07:11:05,problem my bank account cannot verify 😥,0
Digital Fintech A,Digital Fintech,5,2026-06-20 07:06:40,easy to use..one of my fav on9 bank apps,0
Digital Fintech A,Digital Fintech,5,2026-06-20 07:03:35,most of my friend tell me paypal one of best app i must use it,0
Digital Fintech A,Digital Fintech,1,2026-06-20 06:52:49,"Customer service is appalling. I have used PayPal almost exclusively for well over 10 years and recently had an account issue due to my bank account being compromised outside PayPal which led to my account and card being locked while my bank fixed the issue. In those 4 days, a Pay-In-4 payment was missed and even though I made it up within days, I am now not able to use the Pay-In-4 option. I tried to get a resolution but got generic responses only. Appalling.",0
Digital Fintech A,Digital Fintech,5,2026-06-20 05:50:15,"i give 5 star and more than 10 star ,very exprensive good apps for funds transfer to my own bank acct..thanks you very much too all and bank company owner..good app wallet,nice,easy,good faster trustly all payment funds..",0
Digital Fintech A,Digital Fintech,5,2026-06-20 05:45:43,PayPal is a convenient and secure payment app. It makes online payments fast and easy.,0
Digital Fintech A,Digital Fintech,1,2026-06-20 05:41:13,"Repeated forced updates for no reason, and they keep changing the layout and making things even more unintuitive and complicated than they already were.",258
Digital Fintech A,Digital Fintech,5,2026-06-20 05:39:02,"its easier to me if my aunt wanted to send Money from another country ehheeh, and the feature its also easy to use",0
Digital Fintech A,Digital Fintech,1,2026-06-20 05:27:37,horrible it's horrible I can't access my PayPal it's horrible thinking about just doing away with it app seems to me nothing but trouble and problems I don't need to stress in my life,0
Digital Fintech A,Digital Fintech,5,2026-06-20 04:54:02,works for what I work it for,0
Digital Fintech A,Digital Fintech,5,2026-06-20 04:09:59,better than any bank,0
Digital Fintech A,Digital Fintech,1,2026-06-20 04:03:12,"Could always count on your app, what happened ?",0
Digital Fintech A,Digital Fintech,1,2026-06-20 03:59:12,ID verification trash. Been trying for hours to verify my identity and it just takes me back to the beginning. The app is filled with so many bugs. with how much in fees they take you'd think they'd pay the devs a good amount to not have these issues. And now I cant do nothing with the 100s in bitcoin I bought because it didnt need my identity to buy but it does to transfer. smdh,0
Digital Fintech A,Digital Fintech,5,2026-06-20 03:44:59,Safe and trusted for online shopping and sending/receiving money across borders.,0
Digital Fintech A,Digital Fintech,5,2026-06-20 03:02:42,pretty good so far....,0
Digital Fintech A,Digital Fintech,1,2026-06-20 02:45:52,"I am a new user, I have been trying to sign in for days.but I have been unable to pls do something about your network so new comers can register.",0
Digital Fintech A,Digital Fintech,5,2026-06-20 02:41:50,Helpful,0
Digital Fintech A,Digital Fintech,3,2026-06-20 02:05:19,"I couldn't get into My account,but I had to get a card so I could use it and PayPal would not let me add it to my account and I was wanting help a robot get to answer the question and I sitting there fighting with a bot talk about stupid bring back real people,!!!!",0
Digital Fintech A,Digital Fintech,5,2026-06-20 01:56:26,"PayPal is okay I can't complain about them too much. I've had them for 8 years and I will say they are constantly improving. I work for myself so they do make it easy to receive credit card payments by offering an option where you send the client an invoice and they pay you with a credit card through that invoice. very handy, like I said they are always improving",0
Digital Fintech A,Digital Fintech,1,2026-06-20 01:41:35,"very annoying app only just to recover forgotten password they can't do, for more than 1hour I don't have such patient to weast on such .",0
Digital Fintech A,Digital Fintech,5,2026-06-20 01:39:35,"wonderful ,fast , reliable and professional app",0
Digital Fintech A,Digital Fintech,1,2026-06-20 01:39:13,well I tried to close my old account down that had money in it I donated the money out of it so I could close it and it is still yet to be closed after calling four times I'm unable to use my new account because the old account is still attached to my name meaning my information is still attached to another account so the money that I have in my new account I'm still unable to use it's ridiculous I've called like four times trying to get it shut down and for some reason they can't do it or won't,0
Digital Fintech A,Digital Fintech,4,2026-06-20 00:54:03,Good experience,0
Digital Fintech A,Digital Fintech,5,2026-06-20 00:47:50,awesome,0
Digital Fintech A,Digital Fintech,5,2026-06-20 00:19:25,Love the App!,0
Digital Fintech A,Digital Fintech,1,2026-06-20 00:16:34,"Don't download it , it will not let you log in",0
Digital Fintech A,Digital Fintech,1,2026-06-20 00:02:24,I would give a lower rating of I could they deactivated my account and refused to tell me why. they refused to tell me what the risk concern was and made it to where I can not use PayPal anymore and I lost the money in my account. I strongly suggest that nobody uses this app,0
Digital Fintech A,Digital Fintech,1,2026-06-19 23:44:12,Suxs wouldn't let me tie the card to the app,0
Digital Fintech A,Digital Fintech,5,2026-06-19 23:01:32,always a success UK to Jo'burg,0
Digital Fintech A,Digital Fintech,5,2026-06-19 22:36:28,play with paypal,0
Digital Fintech A,Digital Fintech,3,2026-06-19 22:36:11,"Knocked it down from 5 to 3, as a recent update regressed the app. When you write a comment with a payment, you cannot see what you type as the screen is taken up by some unwanted giant emoji options. annoying as f*.",0
Digital Fintech A,Digital Fintech,5,2026-06-19 22:02:11,Great app,0
Digital Fintech A,Digital Fintech,5,2026-06-19 21:54:54,excellent app,0
Digital Fintech A,Digital Fintech,5,2026-06-19 21:53:06,this is a very good app,0
Digital Fintech A,Digital Fintech,2,2026-06-19 21:20:53,why does it say I'm a cheat when I go to cash out a large amount of money and it won't help,0
Digital Fintech A,Digital Fintech,5,2026-06-19 21:15:57,Awesome,0
Digital Fintech A,Digital Fintech,5,2026-06-19 21:06:42,Very good financial,0
Digital Fintech A,Digital Fintech,1,2026-06-19 20:47:55,I need to speak to a human otherwise your app is useless to me,0
Digital Fintech A,Digital Fintech,1,2026-06-19 20:43:15,"limiting accounts for your confidential criteria, this is not for artists, do not use paypal if u dont want to be suspended permanently 💀",0
Digital Fintech A,Digital Fintech,1,2026-06-19 20:37:05,"(edit) log in system was faulty 5 years ago and only received a couple months within that year. 5 years later and now I'm dealing with a new issue, Charge Back Protection, specifically the other end of it. not only have I sent the money of these charges but now I'm paying double of each payment already sent. so much so that cases are being opened up behind my back to pay this company more. putting together court document and deleting this account when finished",56
Digital Fintech A,Digital Fintech,5,2026-06-19 20:28:38,lovely,0
Digital Fintech A,Digital Fintech,1,2026-06-19 20:00:24,I hate this app it's always taking money off my card and I can't do nothing cuz it's always asking me my password and then when I put it in its telling me that that's not it I hate PayPal,0
Digital Fintech A,Digital Fintech,1,2026-06-19 19:51:39,don't let me mSke a acc ount,0
Digital Fintech A,Digital Fintech,5,2026-06-19 19:33:02,the only thing I can move my account with today,0
Digital Fintech A,Digital Fintech,2,2026-06-19 19:30:56,I'm not able to take screenshots when I send money PayPal not always sending receipts to my email,0
Digital Fintech A,Digital Fintech,2,2026-06-19 19:07:20,stops every 5 second. have to choise wait every timr,0
Digital Fintech A,Digital Fintech,5,2026-06-19 19:01:19,I believe it will be a very good and quick app if only the time needed to get codes from my Google account to it will be increase. the time is just 5 second please it is too short. this is so because before the codes drops in my email fore to pick it and paste 5 second already over than I will start allover again and again without success thereby hindering me from performing any transactions.,0
Digital Fintech A,Digital Fintech,5,2026-06-19 18:58:17,I love this app,0
Digital Fintech A,Digital Fintech,1,2026-06-19 18:57:21,"what a bad app too be honest , recently i got scammed by 20$ I make a poster work for someone and he payed me 20$ and after 1 month that guy filed a refund on PayPal and the thing is PayPal actually send him the refund after 15 days of review and he don't have a single proof i scammed him but I have every chats screenshot and he only take refunded by doing chats to paypal it's hard to believe that a guy who don't have any single proof and even paypal is not even asking him proofs , worst app",0
Digital Fintech A,Digital Fintech,5,2026-06-19 18:41:51,stupid,0
Digital Fintech A,Digital Fintech,3,2026-06-19 18:28:00,doesn't let me add a note when sending or requesting $€£,0
Digital Fintech A,Digital Fintech,5,2026-06-19 18:25:50,good,0
Digital Fintech A,Digital Fintech,5,2026-06-19 18:23:58,Fast transfers,0
Digital Fintech A,Digital Fintech,1,2026-06-19 18:03:47,"one of the worst apps to be ever invented, they're thieves and I repeat once more, they're THIEVES, they just decided to steal my $50 even after promising that it would be released after the 180 days. they will take your money and there is nothing you will do about it. tried reaching out to customer service agents and all they could say is that it's their internal department ruling and there is nothing they can do about it. they will steal your money without any clear reason as to why.",1
Digital Fintech A,Digital Fintech,1,2026-06-19 17:59:14,no more! PayPal used to be a guarantee and safe payment method for online purchases. past few years their service and support has gone way downhill. One of the worst AI chat bots I've dealt with in quite some time. it used to be you could count on them to help you with invalid payments that you did not authorize. now you have to not only deal directly with vendor but you have to wait 6 MONTHS before PayPal will step in and help. not what I signed up for and not one that will have your back.,1
Digital Fintech A,Digital Fintech,5,2026-06-19 17:29:17,"I've tried a lot of apps like this, but this one truly stands out. The interface is clean, easy to navigate, and everything works smoothly without unnecessary complications. I appreciate how much effort the developers put into both the design and performance. It has become part of my daily routine because it's reliable and does exactly what it promises. Highly recommended to anyone looking for a well-made app. Keep up the amazing work!",0
Digital Fintech A,Digital Fintech,1,2026-06-19 17:04:43,I don't like the money on hold it,0
Digital Fintech A,Digital Fintech,5,2026-06-19 17:02:48,Most Favorite Paypal The #1 App,0
Digital Fintech A,Digital Fintech,5,2026-06-19 16:57:47,"A lot of people write different things, but for me, PayPal is a great app with a lot of features.",0
Digital Fintech A,Digital Fintech,3,2026-06-19 16:18:55,"Your scanning of face and ID needs work. It's ridiculous how long it takes to get a scan. closer, center Your face, closer, closer, center Your face, it never ends. then the ID took forever. Finally, we can't verify you. Stupid app. My ID expires in a couple years and, gasp, you age in 5 years. Definitely not up to the standards of newer technology. Try sticking some money into your app once in awhile.",0
Digital Fintech A,Digital Fintech,5,2026-06-19 15:53:55,Smooth,0
Digital Fintech A,Digital Fintech,2,2026-06-19 15:40:47,I really don't trust it too much.,0
Digital Fintech A,Digital Fintech,5,2026-06-19 15:37:09,easy to use!,0
Digital Fintech A,Digital Fintech,2,2026-06-19 15:27:05,The app keeps forcing itself to stop. AND I was locked out of my account for no reason. Love that this app totally works.,0
Digital Fintech A,Digital Fintech,1,2026-06-19 15:15:07,"Regulasi paypal terlalu sensitif, sedikit2 langsung merah perlu ngisi biodata pelengkap, tidak dapat di andalkan, sangat tidak di rekomendasikan untuk di pakai pembayaran lintas negara 👎",0
Digital Fintech A,Digital Fintech,5,2026-06-19 15:13:12,nice apps,0
Digital Fintech A,Digital Fintech,5,2026-06-19 15:08:54,👌 best,0
Digital Fintech A,Digital Fintech,5,2026-06-19 15:05:53,"Secure online payment platform offering convenient transactions, buyer protection, and easy money transfers across many countries.",0
Digital Fintech A,Digital Fintech,1,2026-06-19 15:03:35,"It is infuriating that I need to enter the totp after biometrics, EVERY time I open the app. edit: still happening after a year.",0
Digital Fintech A,Digital Fintech,1,2026-06-19 14:53:40,I'm having an extremely hard time setting up this app.,0
Digital Fintech A,Digital Fintech,1,2026-06-19 14:06:44,tried to transfer my balance to my debit card and it keeps saying that its having problems knowing its me. Made me re enter my password then made me enter a confirmation code from my email and then verify my 16 digit card on file. After doing all that it made me reset my password only for it say the same thing again. Very frustrating.,0
Digital Fintech A,Digital Fintech,2,2026-06-19 14:00:24,"Hello there! please help me, my paypal account was compromised. I cannot log in now and my email address is not recognized.",0
Digital Fintech A,Digital Fintech,1,2026-06-19 13:54:03,"if your account has limitation access and you can not appeal, then PayPal refuses to inform you why your account has limited access, and will inform you to read the users term, and will not give the the transaction that caused it, plus they will not delete your account! basically you will not be able to use the platform ever again! it doesn't make since if I am unable to use PayPal's services why would I keep my information in their servers! how come PayPal dose not allow to delete the account",0
Digital Fintech A,Digital Fintech,5,2026-06-19 13:53:25,Great app to make money and have your online business.,0
Digital Fintech A,Digital Fintech,4,2026-06-19 13:47:14,The speed and ease sending money is very much appreciated!,0
Digital Fintech A,Digital Fintech,5,2026-06-19 13:45:14,👍,0
Digital Fintech A,Digital Fintech,5,2026-06-19 12:45:07,good,0
Digital Fintech A,Digital Fintech,5,2026-06-19 12:41:37,Been using for years. Never an issue and now I can send funds directly to my venmo😊,0
Digital Fintech A,Digital Fintech,5,2026-06-19 12:03:02,Digital powered application that proves the owner himself,0
Digital Fintech A,Digital Fintech,3,2026-06-19 12:01:02,slow,0
Digital Fintech A,Digital Fintech,5,2026-06-19 11:45:01,many foreigner use this app with positive feedback,0
Digital Fintech A,Digital Fintech,1,2026-06-19 11:43:34,"ABSOLUTELY HORRIBLE. CONSTANT CRASHING. DOESN'T MATTER WHAT DEVICE I AM ON. ASKS FOR MY FINGERPRINT AND I NEVER SET IT UP THAT WAY. PLEASE DON'T DOWNLOAD PAYPAL! USE VENMO, CHIME, ANYTHING ELSE!! BOO",0
Digital Fintech A,Digital Fintech,5,2026-06-19 11:31:53,paypal is app easy to use even there are many finance app out there,0
Digital Fintech A,Digital Fintech,1,2026-06-19 11:27:57,hopeless customer service,0
Digital Fintech A,Digital Fintech,1,2026-06-19 11:20:10,"after receiving money that I earned answering surveys, they permanently deactivating my account. now, I wasn’t able to withdraw my money. i don’t know why they keep holding that small amount that I really need to use. I already email them that I need that money badly but they don’t give a dmn.",0
Digital Fintech A,Digital Fintech,5,2026-06-19 10:49:38,excellent 👌,0
Digital Fintech A,Digital Fintech,2,2026-06-19 10:42:54,very bad experience,0
Digital Fintech A,Digital Fintech,5,2026-06-19 09:26:12,Not getting scammed again. PayPal offers a protection plan. purchase with confidence,0
Digital Fintech A,Digital Fintech,5,2026-06-19 09:24:50,Always cakewalk. when I need to send a PayPal it always works even on cellular. love this app.,0
Digital Fintech A,Digital Fintech,3,2026-06-19 09:00:53,I'm having the worst headache trying to get my Very First PayPal account set up Right. Not even for my #GOFUNDME account 😪.,0
Digital Fintech A,Digital Fintech,1,2026-06-19 08:43:49,why did this app can't installed?,0
Digital Fintech A,Digital Fintech,3,2026-06-19 06:33:16,didn't know I was being charged for this service,0
Digital Fintech A,Digital Fintech,5,2026-06-19 06:05:26,I have been a PayPal user for years. I trust this payment system. ✨️💎✨️🙏🏽✨️💯✨️,1
Digital Fintech A,Digital Fintech,3,2026-06-19 05:49:54,"It is a reputable app but I feel they're not fully transparent on the fact that sending money through your bank account or bank debit card changes if you get charged a fee or not. the first time I sent money &paid fee. I had to look up what way was free to transfer. When I went to link my bank account it kept asking me to enter correct username and password of bank I did,4 times. so now im not linked to my bank account and still paying fee. annoyed.",0
Digital Fintech A,Digital Fintech,4,2026-06-19 05:31:16,dnt like the fee. but other than that its a good app,0
Digital Fintech A,Digital Fintech,1,2026-06-19 05:27:01,"This PayPal app requires us to use our personal phone lock as it's PassKey, then requires us to link our bank account to the app. That is NOT happening! All I want to do is pay a vendor by linking a credit card to this PyPl account in order to pay vendors that way, but the app doesn't allow that. That's a Total FAIL, imho!",6
Digital Fintech A,Digital Fintech,5,2026-06-19 05:04:51,Very Seamless!!,0
Digital Fintech A,Digital Fintech,5,2026-06-19 04:46:39,enjoyed,0
Digital Fintech A,Digital Fintech,5,2026-06-19 04:45:58,so much better than before!! 🤩,0
Digital Fintech A,Digital Fintech,5,2026-06-19 04:39:12,easy way good,0
Digital Fintech A,Digital Fintech,4,2026-06-19 04:18:43,This app has improved a great deal over the years that I have use it,0
Digital Fintech A,Digital Fintech,5,2026-06-19 04:05:06,peak,0
Digital Fintech A,Digital Fintech,5,2026-06-19 03:36:52,love,0
Digital Fintech A,Digital Fintech,5,2026-06-19 03:35:25,still lookin good... in my neighborhood,0
Digital Fintech A,Digital Fintech,5,2026-06-19 03:20:16,use the app to help save money for emergencies,0
Digital Fintech A,Digital Fintech,5,2026-06-19 02:43:59,"I like this app, its make my day more easyer..",0
Digital Fintech A,Digital Fintech,5,2026-06-19 02:42:06,very secure. appreciate being able to make payments with confidence online.,0
Digital Fintech A,Digital Fintech,2,2026-06-19 02:21:17,there she to be an increased fraud going on with PayPal and I can't report it. has anyone experienced this?,0
Digital Fintech A,Digital Fintech,5,2026-06-19 01:38:00,Easy to use and fast,0
Digital Fintech A,Digital Fintech,4,2026-06-19 01:14:25,great have a nice day,0
Digital Fintech A,Digital Fintech,1,2026-06-19 00:52:48,You Wanna People To Play Your Games But When It Comes To Paying Them You Don't You Are No More Than Scammers Ripping People off Players Beware !,0
Digital Fintech A,Digital Fintech,1,2026-06-19 00:51:29,imagine being a platform about money and yet I can't add money,0
Digital Fintech A,Digital Fintech,1,2026-06-19 00:47:07,"App is useless as I can't sign in on app automatically, I have to click change every time I open app as all I get is spinning loading sign so have to click change and login again, every time I open app and because of this I might as well just login to PayPal through a browser.",0
Digital Fintech A,Digital Fintech,5,2026-06-19 00:44:05,very awesome app Thank You Developer's 😊,0
Digital Fintech A,Digital Fintech,5,2026-06-19 00:33:21,my #1,0
Digital Fintech A,Digital Fintech,5,2026-06-19 00:24:39,excellent,0
Digital Fintech A,Digital Fintech,5,2026-06-19 00:21:19,very good,0
Digital Fintech A,Digital Fintech,1,2026-06-19 00:20:08,0/5.,0
Digital Fintech A,Digital Fintech,5,2026-06-19 00:19:48,😄,0
Digital Fintech A,Digital Fintech,1,2026-06-19 00:04:31,this particular PayPal app was wanted to look into my Gmail account and everything else it should not have asked for. it is a scam why did you give it to me to begin with,0
Digital Fintech A,Digital Fintech,1,2026-06-19 00:03:34,I have no account with paypal!,0
Digital Fintech A,Digital Fintech,5,2026-06-18 23:28:36,Awesome,0
Digital Fintech A,Digital Fintech,1,2026-06-18 23:27:39,I can't send a message and can't send a call. It's not like I have other verification options. One star for inconvenience.,0
Digital Fintech A,Digital Fintech,5,2026-06-18 23:12:52,Seamless efficient user interface to pay or receive money. Easy to connect to numerous sources to pay quickly. the most current version puts the keyboard over the comments area so you can not see the text you type. very annoying,1
Digital Fintech A,Digital Fintech,1,2026-06-18 23:11:10,PAYPAL. I WAS BORN IN 2004. IM 22 TWENTY-TWO. LET ME SIGN UP FOR YOUR APP,0
Digital Fintech A,Digital Fintech,1,2026-06-18 23:07:51,"wallet icon/option has disappeared. cleared cache, re-installed and still gone.",0
Digital Fintech A,Digital Fintech,5,2026-06-18 22:44:00,everything is okayy in this app 💗,0
Digital Fintech A,Digital Fintech,5,2026-06-18 22:39:57,I've been using PayPal for years and it is always dependable.,0
Digital Fintech A,Digital Fintech,5,2026-06-18 22:36:50,makes life easier ~ for sure❣️,0
Digital Fintech A,Digital Fintech,5,2026-06-18 22:31:03,very nice,0
Digital Fintech A,Digital Fintech,3,2026-06-18 22:24:57,terrible never can log on,0
Digital Fintech A,Digital Fintech,5,2026-06-18 22:13:35,"Sometimes, it's very hard to simply transfer money from one PayPal account to another. PayPal account. Thanks",0
Digital Fintech A,Digital Fintech,5,2026-06-18 22:10:46,"I've used this app for about 7 years and it's always been useful especially when I need it most, thank you for your wonderful platform 🙏",0
Digital Fintech A,Digital Fintech,5,2026-06-18 22:10:14,I've been using paypal for several r years now and never any problem,0
Digital Fintech A,Digital Fintech,1,2026-06-18 21:53:36,Was trying to EDIT /DELETE EXPIRED CARDS Add/UPDATE a new card what a CLUSTER,0
Digital Fintech A,Digital Fintech,5,2026-06-18 21:50:15,"Great, reliable!",0
Digital Fintech A,Digital Fintech,4,2026-06-18 21:40:32,"It's fast and convenient. Hmm. Its just the people behind it and the companies wrongdoings that make me deduct a star, since 5/5 service, 3/5 company => 4/5 rating.",0
Digital Fintech A,Digital Fintech,2,2026-06-18 20:39:28,The fees to transfer money is crazy.,0
Digital Fintech A,Digital Fintech,5,2026-06-18 20:30:47,works for me,0
