App_Category,App_Type,Score,Review_Date,Review_Content,Thumbs_Up
Traditional Bank A,Traditional Bank,5,2026-05-28 06:59:53,"best bank I've ever been a customer to, the app is easy to use and has EVERYTHING you need. I have banked at 2 other banks besides this one and I will never be happy using another bank besides chase again. Every App, bank, business, and product should be held to this conveniency and customer support standard.",1
Traditional Bank A,Traditional Bank,5,2026-05-28 06:51:26,easy Helpful when I need Help.,0
Traditional Bank A,Traditional Bank,5,2026-05-28 04:06:36,THEY'VE NEVER FAILED ME YET!!!,0
Traditional Bank A,Traditional Bank,5,2026-05-28 04:05:43,Amazon works with them,0
Traditional Bank A,Traditional Bank,1,2026-05-28 03:35:19,No app support so you need to call them and chase doesn't allow you to transfer your money to another bank. I had to call them twice because they blocked my account and denied the transfer twice. When I called again after the second time they said the back office is not going to allow the transfer for unknown reasons and I have to do wire instead. Figures because wire has a 25 USD fee,2
Traditional Bank A,Traditional Bank,5,2026-05-28 01:18:48,my united card from chase is awesome,0
Traditional Bank A,Traditional Bank,2,2026-05-28 00:15:43,"App is fine but not what I'd expect of such a large corporation. The sign is constantly resetting itself, why have biometric if that doesn't save? I prefer Discover...",0
Traditional Bank A,Traditional Bank,3,2026-05-28 00:07:53,"still can't figure out the ""reward"" system & how it works though.",0
Traditional Bank A,Traditional Bank,1,2026-05-27 23:56:17,too difficult to pay bills,0
Traditional Bank A,Traditional Bank,1,2026-05-27 23:54:04,"sure, works fine until they remove access. then it's cancer",0
Traditional Bank A,Traditional Bank,4,2026-05-27 23:34:58,I like this app. This app is good for banking purposes and it is very convenient and effective,0
Traditional Bank A,Traditional Bank,3,2026-05-27 22:41:54,getting an error while trying to check credit score. says unable to use due to being rooted or malware but neither are true.,0
Traditional Bank A,Traditional Bank,1,2026-05-27 20:20:00,New update thinks my phone is rooted/jailbroken so it locks up a lot of features. Apparently this is happening to a lot of others too,0
Traditional Bank A,Traditional Bank,5,2026-05-27 19:41:31,THE BEST....BETTER THAN ALL THE REST!,0
Traditional Bank A,Traditional Bank,1,2026-05-27 19:31:45,right in the middle of me using the app for a critical reason you asked me about a stupid survey,0
Traditional Bank A,Traditional Bank,3,2026-05-27 19:17:42,"despite being on time with payments, they will not lower my percentage rate.",0
Traditional Bank A,Traditional Bank,5,2026-05-27 19:04:47,love this bank,0
Traditional Bank A,Traditional Bank,3,2026-05-27 17:50:43,The 5% categories are absolutely pathetic.,0
Traditional Bank A,Traditional Bank,4,2026-05-27 17:33:54,I wish the cc cash-back categories were automatically applied and you didn't have to select them every quarter.,0
Traditional Bank A,Traditional Bank,5,2026-05-27 17:26:33,Works good enough for me,0
Traditional Bank A,Traditional Bank,5,2026-05-27 17:04:32,easy ro set up and use,0
Traditional Bank A,Traditional Bank,5,2026-05-27 17:00:25,very easy to navigate.,0
Traditional Bank A,Traditional Bank,1,2026-05-27 16:40:18,"the app is slow, never lets me use the fingerprint sign in that I set up, even the app account ing is wrong. Wow that's wack.",0
Traditional Bank A,Traditional Bank,5,2026-05-27 15:55:14,"Chase is great with helping people manage their basic bank accounts, including credit cards. the banking information is always detailed and consistent.",0
Traditional Bank A,Traditional Bank,1,2026-05-27 14:46:40,Ads with a side of finance. Shameless.,0
Traditional Bank A,Traditional Bank,1,2026-05-27 14:29:55,keeps messing with my credit score,0
Traditional Bank A,Traditional Bank,5,2026-05-27 12:17:30,Love Chase ❤️,0
Traditional Bank A,Traditional Bank,1,2026-05-27 08:11:37,"not supporting older phones, bad business",0
Traditional Bank A,Traditional Bank,5,2026-05-27 08:11:28,great since I've downloaded and got back to working forms or stance app wise I guess,0
Traditional Bank A,Traditional Bank,3,2026-05-27 07:33:12,"🤔LACKING because Sat and Sun are still spending days and days I want to stay on top of all transactions and I know it's possible and then nothing on Mondays for years is very disconcerting. OLD Chase app used to show each transaction very very shortly after it happened and within a couple hours or less. Also, have to login every single time I want to see a transaction. App does not always work.",3
Traditional Bank A,Traditional Bank,5,2026-05-27 06:59:35,chase has always been great for me 7 years and counting,0
Traditional Bank A,Traditional Bank,1,2026-05-27 06:02:50,they won't increase me limit,0
Traditional Bank A,Traditional Bank,2,2026-05-27 05:28:24,APR to high,0
Traditional Bank A,Traditional Bank,5,2026-05-27 04:30:51,Love the easy to read notifications.,0
Traditional Bank A,Traditional Bank,5,2026-05-27 04:20:23,MY OPION IS CHASE.IS BY FAR THE BEST BANK IVE EVER BANKED AT.,0
Traditional Bank A,Traditional Bank,5,2026-05-27 04:03:36,very pleased with Chase card.,0
Traditional Bank A,Traditional Bank,1,2026-05-27 03:42:12,I don't think with Chase I don't use this app I downloaded it before because I was thinking about banking with Chase but they have too many fees and if you don't leave a certain amount of money in your checking account they will see you for that too like $25 fee everyday,0
Traditional Bank A,Traditional Bank,5,2026-05-27 03:24:48,works great. great ui,0
Traditional Bank A,Traditional Bank,1,2026-05-27 03:02:21,Way to support the throw-away society and alienate all of your customers using a perfectly functional phone over 5 years old.,0
Traditional Bank A,Traditional Bank,5,2026-05-27 03:00:23,Very easy to use.,0
Traditional Bank A,Traditional Bank,5,2026-05-27 02:55:53,good card,0
Traditional Bank A,Traditional Bank,5,2026-05-27 00:07:45,easy to navigate tasks.,0
Traditional Bank A,Traditional Bank,1,2026-05-26 22:59:39,"Terrible experience, Chase disregarded all information on my CC application and set me up with outdated data from 2001 instead. I sent written confirmation asking for corrected info and they still disregarded it",0
Traditional Bank A,Traditional Bank,1,2026-05-26 21:18:10,Engineered by complete idiots. To log in you need an SMS verification code. But this jackass company takes over 15 minutes to send the code. Stupid stupid stupid.,0
Traditional Bank A,Traditional Bank,5,2026-05-26 21:00:40,good and easy,0
Traditional Bank A,Traditional Bank,5,2026-05-26 16:46:30,this financial institution has always been there and had my back. customer service is tpp notch. the only issue i ever see is getting a hold of them in a timely manner. but overall a great bank,0
Traditional Bank A,Traditional Bank,4,2026-05-26 13:43:37,App is fine. 4 stars instead of 5 because Chase stopped allowing cash rewards to be deposited into non-Chase accounts. My Citi & AMEX still allow for cash rewards to be deposited into my non-Chase account. Typically corporate greed at it again.,0
Traditional Bank A,Traditional Bank,5,2026-05-26 12:50:25,thanks thanks,0
Traditional Bank A,Traditional Bank,1,2026-05-26 12:26:24,I can't use some features on the app simply because I have a VPN installed on my phone. This is ridiculous.,0
Traditional Bank A,Traditional Bank,5,2026-05-26 09:14:31,The app is easy to use,0
Traditional Bank A,Traditional Bank,5,2026-05-26 07:00:10,easy to navigated and very safe,0
Traditional Bank B,Traditional Bank,5,2026-06-20 14:32:48,Intuitive and smooth. Love having access to my credit score so easily. Communication through the app for a dispute and records is a snap.,0
Traditional Bank B,Traditional Bank,5,2026-06-20 14:12:20,"I use the Citi Bank app only for my Costco Anywhere Visa. Fast biometric login, easy balance checks, bill pay, and rewards tracking (2% Costco, 4% gas). Autopay works great. Filed a smooth dispute for my Samsung purchase—strong security with instant card lock. Minor slow refreshes and basic UI. Still reliable for shift work. 4.3/5. Good for Costco card users.",0
Traditional Bank B,Traditional Bank,5,2026-06-20 13:44:33,easy-to-use,0
Traditional Bank B,Traditional Bank,5,2026-06-20 10:21:48,rasy to use,0
Traditional Bank B,Traditional Bank,5,2026-06-20 08:47:24,"As a college student, I have found the Costco Citi Card to be very helpful for saving money on affordable gas while earning annual cash back rewards. The mobile app is easy to navigate, and the card provides a reasonable credit limit that makes it easy to maintain a low utilization rate and keep over 89% of my available balance available for future purchases. 👌",0
Traditional Bank B,Traditional Bank,5,2026-06-20 08:41:19,"easy to use, relatively intuitive.",0
Traditional Bank B,Traditional Bank,5,2026-06-20 08:32:22,awesome credit.,0
Traditional Bank B,Traditional Bank,5,2026-06-20 08:19:11,Great service thank you,0
Traditional Bank B,Traditional Bank,5,2026-06-20 08:16:19,very fast and convenient.,0
Traditional Bank B,Traditional Bank,5,2026-06-20 07:22:14,Very easy to use and flexible payment options.,0
Traditional Bank B,Traditional Bank,5,2026-06-20 07:20:14,awesome,0
Traditional Bank B,Traditional Bank,5,2026-06-20 07:14:37,They worked with me to solve the problem,0
Traditional Bank B,Traditional Bank,5,2026-06-20 06:15:42,love it,0
Traditional Bank B,Traditional Bank,5,2026-06-20 05:55:35,easy to use and access to perks is easy also.,0
Traditional Bank B,Traditional Bank,5,2026-06-20 05:53:27,user friendly easy to navigate I would recommend,0
Traditional Bank B,Traditional Bank,5,2026-06-20 05:33:59,easy to use,0
Traditional Bank B,Traditional Bank,5,2026-06-20 05:20:05,The app runs efficiently as of June 2026,0
Traditional Bank B,Traditional Bank,1,2026-06-20 04:30:48,"all of a sudden today I can no longer sign in (biometrics, password, or pin). no updates or changes to my phones biometrics. it logs in for maybe half a second, then logs out and says ""For security reasons, we cannot allow you to proceed. If you require assistance, please contact Citibank Online Customer Service and mention Error Code MFA."" I can login via web no-issue. I'm about to travel internationally and will need to receive push notifications to confirm purchases.",0
Traditional Bank B,Traditional Bank,4,2026-06-20 04:14:38,I like the text when I went shopping out of my usual area.,0
Traditional Bank B,Traditional Bank,4,2026-06-20 03:02:21,Easy to use,0
Traditional Bank B,Traditional Bank,5,2026-06-20 02:31:12,Just recently started using this app because my last bank transferred me to CITI. So far I really like 👍🏻 it !,0
Traditional Bank B,Traditional Bank,5,2026-06-20 01:38:45,So far so good! Easy to use and I am secured with fingerprints for access. I love this app,1
Traditional Bank B,Traditional Bank,4,2026-06-20 01:17:03,so far it's been a good experience with citi bank.,0
Traditional Bank B,Traditional Bank,5,2026-06-20 01:07:58,great!!!!!,0
Traditional Bank B,Traditional Bank,5,2026-06-20 01:00:47,terrible app. many bugs. Locks you out at times. Customer service is useless for help.,0
Traditional Bank B,Traditional Bank,5,2026-06-20 00:48:21,This app is very easy to use.,0
Traditional Bank B,Traditional Bank,5,2026-06-20 00:18:47,easy to use...have had no problems,0
Traditional Bank B,Traditional Bank,5,2026-06-19 23:57:11,great app,0
Traditional Bank B,Traditional Bank,5,2026-06-19 23:43:18,Easy to use! Takes only a minute to pay!,0
Traditional Bank B,Traditional Bank,5,2026-06-19 23:12:28,easy. intuitive.,0
Traditional Bank B,Traditional Bank,4,2026-06-19 22:24:10,well organized,0
Traditional Bank B,Traditional Bank,5,2026-06-19 22:24:01,Good,0
Traditional Bank B,Traditional Bank,5,2026-06-19 21:58:17,great,0
Traditional Bank B,Traditional Bank,5,2026-06-19 21:51:31,Easy to use and straight forward,0
Traditional Bank B,Traditional Bank,5,2026-06-19 21:31:41,Absolutely awesome app,0
Traditional Bank B,Traditional Bank,5,2026-06-19 21:29:24,Easy to use,0
Traditional Bank B,Traditional Bank,5,2026-06-19 21:16:17,easy to pay bill,0
Traditional Bank B,Traditional Bank,5,2026-06-19 20:34:44,I love this card and app! Very customer friendly.,0
Traditional Bank B,Traditional Bank,5,2026-06-19 20:29:46,"It's all the banking on the palm of my hand. Great app to have, I recommend it.",5
Traditional Bank B,Traditional Bank,5,2026-06-19 20:05:56,ease of use,0
Traditional Bank B,Traditional Bank,5,2026-06-19 19:17:30,"Easy to set up, easy to use. Very convenient!",0
Traditional Bank B,Traditional Bank,5,2026-06-19 18:40:33,nice app,0
Traditional Bank B,Traditional Bank,5,2026-06-19 18:18:36,Citibank is Awesome,0
Traditional Bank B,Traditional Bank,5,2026-06-19 18:17:52,very easy to understand,0
Traditional Bank B,Traditional Bank,5,2026-06-19 18:04:11,Easy to navigate. Vital info right in summary.,0
Traditional Bank B,Traditional Bank,1,2026-06-19 18:02:30,Consistently needing to uninstall and reinstall the app every time I want to access my account.,0
Traditional Bank B,Traditional Bank,5,2026-06-19 18:01:04,"Very easy to sign in, easy interface and love the accurate and real-time information. Also offers good financial tools for credit management.",0
Traditional Bank B,Traditional Bank,5,2026-06-19 17:52:17,"I had to come back and give Citi an excellent review, customer service is wonderful and they took care of 2 purchases on my credit card I never received,",0
Traditional Bank B,Traditional Bank,5,2026-06-19 17:30:01,easy to use app.,0
Traditional Bank B,Traditional Bank,1,2026-06-19 17:09:16,Too many ads. A PITA to pay a bill. Can't access doc's. Can't access web platform. Overseas customer service and tech support utterly worthless. saying they'll pass on the problem to mgmt.,0
Traditional Bank B,Traditional Bank,5,2026-06-19 17:04:43,"The App makes it easy to review your account, make payments with easy app navigation.",0
Traditional Bank B,Traditional Bank,5,2026-06-19 16:46:39,very intuitive,0
Traditional Bank B,Traditional Bank,5,2026-06-19 16:40:07,easy to use and navigate,0
Traditional Bank B,Traditional Bank,5,2026-06-19 16:37:23,it's great,0
Traditional Bank B,Traditional Bank,5,2026-06-19 15:38:18,Great 👍🏾,0
Traditional Bank B,Traditional Bank,5,2026-06-19 15:18:01,Easy to access all needed information my business. Love it.,0
Traditional Bank B,Traditional Bank,5,2026-06-19 14:39:41,"easy to use. check your balance, make a payment.",0
Traditional Bank B,Traditional Bank,5,2026-06-19 13:08:34,super easy to navigate,0
Traditional Bank B,Traditional Bank,5,2026-06-19 12:32:17,very easy,0
Traditional Bank B,Traditional Bank,5,2026-06-19 11:25:46,App is very easy to navigate. It gives all the info regarding your account on the first page.,0
Traditional Bank B,Traditional Bank,5,2026-06-19 09:17:47,it works. haven't had an issue.,0
Traditional Bank B,Traditional Bank,5,2026-06-19 08:59:19,"When charges are made, I like the almost instant notification.",0
Traditional Bank B,Traditional Bank,4,2026-06-19 06:55:01,easy to navigate,0
Traditional Bank B,Traditional Bank,5,2026-06-19 06:47:47,You guys are awesome!!! No complaints!!! Excellent customer service!!!💯,0
Traditional Bank B,Traditional Bank,5,2026-06-19 06:14:12,out of all the bank apps I use this is the most direct and works the best. that is all.,0
Traditional Bank B,Traditional Bank,5,2026-06-19 06:07:24,"Great overall app, smooth flow and positive experience!",0
Traditional Bank B,Traditional Bank,5,2026-06-19 05:47:44,Quite simple to use. Includes biometrics. Very helpful.,0
Traditional Bank B,Traditional Bank,4,2026-06-19 04:37:06,"Easy to get on and browse, but difficult getting to the right pg to dispute a charge.",0
Traditional Bank B,Traditional Bank,5,2026-06-19 04:27:01,very easy to use and accomplish what I need to do.,1
Traditional Bank B,Traditional Bank,5,2026-06-19 04:09:45,easy to use and understand navigation.,0
Traditional Bank B,Traditional Bank,5,2026-06-19 03:40:58,exceptional,0
Traditional Bank B,Traditional Bank,5,2026-06-19 03:21:52,easy to browse,0
Traditional Bank B,Traditional Bank,5,2026-06-19 03:04:03,simply the best,0
Traditional Bank B,Traditional Bank,5,2026-06-19 03:01:01,awesome,0
Traditional Bank B,Traditional Bank,5,2026-06-19 02:58:04,great,0
Traditional Bank B,Traditional Bank,5,2026-06-19 02:47:40,loving it,0
Traditional Bank B,Traditional Bank,5,2026-06-19 02:32:12,Easy to use. Easy to navigate to other areas of the app without complications.,0
Traditional Bank B,Traditional Bank,5,2026-06-19 02:29:43,easy to use,0
Traditional Bank B,Traditional Bank,5,2026-06-19 01:56:03,"Easy to use. Accurate, dependable. Keep up the good work!! I don't use it for much, being an old low-tech guy, but I check on my spending & make payments, on the phone, making it pretty handy.",0
Traditional Bank B,Traditional Bank,5,2026-06-19 00:53:44,very helpful!,0
Traditional Bank B,Traditional Bank,5,2026-06-19 00:39:27,easy to use,0
Traditional Bank B,Traditional Bank,5,2026-06-19 00:11:46,"easy to use, secure, convenient",0
Traditional Bank B,Traditional Bank,5,2026-06-18 23:39:39,a+,0
Traditional Bank B,Traditional Bank,5,2026-06-18 23:37:44,Great App,0
Traditional Bank B,Traditional Bank,5,2026-06-18 23:31:30,gives me transaction information nearly instantly,0
Traditional Bank B,Traditional Bank,5,2026-06-18 23:08:38,Efficient and personable.,0
Traditional Bank B,Traditional Bank,5,2026-06-18 23:07:29,Very Easy,0
Traditional Bank B,Traditional Bank,5,2026-06-18 22:54:12,it's easy and useful,0
Traditional Bank B,Traditional Bank,4,2026-06-18 22:53:35,Use it all the time for lots of things. User friendly and fast.,0
Traditional Bank B,Traditional Bank,5,2026-06-18 22:34:06,Really good,0
Traditional Bank B,Traditional Bank,5,2026-06-18 22:24:09,great card good rewards,0
Traditional Bank B,Traditional Bank,5,2026-06-18 22:16:57,Its an easy app to utilize. It's great.,0
Traditional Bank B,Traditional Bank,5,2026-06-18 22:13:53,it works,0
Traditional Bank B,Traditional Bank,5,2026-06-18 22:10:12,Great company,0
Traditional Bank B,Traditional Bank,5,2026-06-18 21:49:51,love the dashboard and ease of use,0
Traditional Bank B,Traditional Bank,5,2026-06-18 21:36:27,easy to use,0
Traditional Bank B,Traditional Bank,3,2026-06-18 21:21:56,"I had to dispute some fraudulent charges on my credit c card, the steps is easy to follow but after done , it doesn't update the status of the charges on the statement to let me know if it has been disputed,even after I tried again many times. I received the message at the last step that it's completed but that's all , in this kind of situation it surely needs improvement.",0
Traditional Bank B,Traditional Bank,5,2026-06-18 21:20:09,Very good and fast app,0
Traditional Bank B,Traditional Bank,5,2026-06-18 21:07:29,"Great app. Easy navigation. Lots of relevant information. My favorite card by far, and the one that I trust and use the most. Super quick money back to my bank acct.",0
Traditional Bank B,Traditional Bank,5,2026-06-18 20:57:15,So easy to use and find what I need.,0
Traditional Bank B,Traditional Bank,5,2026-06-18 20:53:36,Deposit a breeze.,0
Traditional Bank B,Traditional Bank,5,2026-06-18 20:42:26,It is really very helpful and convenient. I really appreciate it..,0
Traditional Bank B,Traditional Bank,5,2026-06-18 20:38:36,"I love Citibank, they are the best. I have had them for over 20 years. I like having my banking available when I want to check on my account. Citibank is the best bank ever! I would recommend Citibank. They are the best in customer service.",0
Traditional Bank B,Traditional Bank,1,2026-06-18 20:25:59,it keeps getting declined and is paid via auto pay in full each month,0
Traditional Bank B,Traditional Bank,5,2026-06-18 20:19:57,"Excellent app, friendly, fast, safe",0
Traditional Bank B,Traditional Bank,5,2026-06-18 20:14:48,"Very user friendly with easy set up. I like that I can customize notifications, automate my payments and easily adjust these if needed. Transparent, lots of information available without the overwhelm. My transactions have always been updated immediately. I earn cash back at Costco. I'm going to buy gas and groceries anyway, put it on the card, pay it back to zero(mine is not $0 at the moment because of two car emergencies last month), earn money by spending the same! No annual fees either.",0
Traditional Bank B,Traditional Bank,5,2026-06-18 20:08:56,Very easy friendly app,0
Traditional Bank B,Traditional Bank,5,2026-06-18 19:51:50,This app makes tracking finances easy. I am able to perform a variety of functions including checking my credit to requesting credit increases. the Citi shop makes shopping much more rewarding. overall I have nothing but great things to say.,0
Traditional Bank B,Traditional Bank,4,2026-06-18 19:21:56,does all the things it's supposed to.,0
Traditional Bank B,Traditional Bank,5,2026-06-18 19:19:11,greatly easily to send money.,0
Traditional Bank B,Traditional Bank,5,2026-06-18 18:53:47,Help me out a lot,0
Traditional Bank B,Traditional Bank,5,2026-06-18 18:48:35,"seamless experience. Able to access and complete updates, payments, or set up autopay, review account status etc.",0
Traditional Bank B,Traditional Bank,5,2026-06-18 18:47:42,working good and very fast!,0
Traditional Bank B,Traditional Bank,5,2026-06-18 18:33:00,easy to use and navigate.,0
Traditional Bank B,Traditional Bank,5,2026-06-18 18:16:50,Just started using the App but so far it is good!!! After almost 3 years I'm still happy with the App. No issues,0
Traditional Bank B,Traditional Bank,5,2026-06-18 18:13:32,Citi Mobile app is easy to use and always available. I check my spending regularly.,0
Traditional Bank B,Traditional Bank,5,2026-06-18 17:41:36,"citi app is easy use , and I appreciate that. Thank you",0
Traditional Bank B,Traditional Bank,5,2026-06-18 17:37:18,fast & easy.,0
Traditional Bank B,Traditional Bank,5,2026-06-18 17:37:08,easy to use,0
Traditional Bank B,Traditional Bank,5,2026-06-18 17:12:06,easy to use,0
Traditional Bank B,Traditional Bank,5,2026-06-18 16:54:11,easy to use,0
Traditional Bank B,Traditional Bank,5,2026-06-18 16:29:41,Very intuitive & easy to use.,0
Traditional Bank B,Traditional Bank,5,2026-06-18 16:19:53,Convenient and user friendly,0
Traditional Bank B,Traditional Bank,4,2026-06-18 16:17:36,It's been giving error for the last 3 weeks. You have to keep instal it every single day. Thanks,0
Traditional Bank B,Traditional Bank,5,2026-06-18 16:11:22,Great app!,0
Traditional Bank B,Traditional Bank,5,2026-06-18 15:37:43,easy to use,0
Traditional Bank B,Traditional Bank,5,2026-06-18 15:21:53,"easy to use, no confusion and most important info when app is first opened.",0
Traditional Bank B,Traditional Bank,5,2026-06-18 14:31:42,easy to use,0
Traditional Bank B,Traditional Bank,5,2026-06-18 13:25:11,Citizens looks out from its customers!,0
Traditional Bank B,Traditional Bank,5,2026-06-18 13:23:32,Great!,0
Traditional Bank B,Traditional Bank,5,2026-06-18 12:45:12,Excellent App,0
Traditional Bank B,Traditional Bank,5,2026-06-18 09:29:23,Easy and fast. good service. Online banking.,0
Traditional Bank B,Traditional Bank,5,2026-06-18 08:52:16,User friendly & simple to use.,0
Traditional Bank B,Traditional Bank,5,2026-06-18 08:49:27,very easy to use,0
Traditional Bank B,Traditional Bank,5,2026-06-18 07:30:05,Very convenient,0
Traditional Bank B,Traditional Bank,5,2026-06-18 06:50:38,Easy and quick to use. Love the app. Same feeling in 2023 as I had in 2020. Great app. Feeling the same in 2024. It's even better.....😀 Still loving it in 2026.😉,0
Traditional Bank B,Traditional Bank,5,2026-06-18 06:37:27,very easy to use and convenient,0
Traditional Bank B,Traditional Bank,5,2026-06-18 06:24:05,Absolutely amazing and very easy to use.,0
Traditional Bank B,Traditional Bank,5,2026-06-18 06:09:12,Reliable info here!,0
Traditional Bank B,Traditional Bank,5,2026-06-18 06:08:38,I haven't had a problem yet. :),0
Traditional Bank B,Traditional Bank,5,2026-06-18 04:54:15,I like the way that it was my cards and house all the information at my fingertips payments go through seamlessly and are posted immediately,0
Traditional Bank B,Traditional Bank,5,2026-06-18 04:20:35,The app is so easy to use. UI is impressively glitch free.,0
Traditional Bank B,Traditional Bank,5,2026-06-18 03:58:29,Card was compromised. The charges were denied and I was immediately notified to call them. My card was cancelled and a new one issued in about 10 minutes. Great customer service!,0
Traditional Bank B,Traditional Bank,5,2026-06-18 03:47:09,👍,0
Traditional Bank B,Traditional Bank,5,2026-06-18 03:38:07,great,0
Traditional Bank B,Traditional Bank,5,2026-06-18 02:59:57,Very easy to use,4
Traditional Bank B,Traditional Bank,5,2026-06-18 02:17:10,great app with easy payment scheduling and excellent notifications and reminders.,0
Traditional Bank B,Traditional Bank,5,2026-06-18 02:04:54,easy to use,0
Traditional Bank B,Traditional Bank,5,2026-06-18 01:35:51,"I'm very grateful for Citi Bank and specifically Excellent Polina at the Solana Beach branch, she is a serious banker and helped me immensely during a devastating breach. This bank, unlike Wells Fargo and Chase actually has your back.",0
Traditional Bank B,Traditional Bank,3,2026-06-18 01:28:27,not sure payment was received i ended up paying double,0
Traditional Bank B,Traditional Bank,5,2026-06-18 01:27:23,easy to set up and very functional.,0
Traditional Bank B,Traditional Bank,5,2026-06-18 01:21:19,Quick and easy,0
